{
  "review_protocol_version": "1.0",
  "reviewer_mode": "independent",
  "canonical_revision_sha256": "10110dc7d7fa729dfc8f5dc67ca37236a6adb5a8f9c8d26b492f24b1d537f266",
  "scores": {
    "business_framing": 2,
    "main_flow": 2,
    "rules_and_decisions": 2,
    "effects": 2,
    "failure_and_recovery": 2,
    "variants": 2,
    "evidence": 2,
    "unknown_discipline": 2
  },
  "total_score": 16,
  "reviewed_at": "2026-08-14T00:00:00Z"
}
