{
  "canonical_revision_sha256": "39732df5a530defa30f90d9eec3596870f6db9691a18ebb4c0edb47a76f08cc5",
  "review_protocol_version": "2.0",
  "reviewed_at": "2026-08-14T00:00:00Z",
  "reviewer_mode": "independent",
  "scores": {
    "business_framing": 2,
    "effects": 2,
    "evidence": 2,
    "failure_and_recovery": 2,
    "main_flow": 2,
    "rules_and_decisions": 2,
    "unknown_discipline": 2,
    "variants": 2
  },
  "total_score": 16
}
